{
  "id": "pain-20260908-creator-audio-loudness-penalty",
  "created_at": "2026-09-08T07:45:00Z",
  "headline": "Solo YouTube & podcast creators get videos down-ranked and ear-raped due to LUFS loudness discrepancies across clips and sponsors",
  "target_audience": {
    "role": "Solo Content Creator / Podcaster",
    "domain": "Digital Media & Video Production",
    "experience_or_scale": "Weekly creator publishing 2-3 videos/podcasts, 15k-80k subscribers"
  },
  "scenario": "Exporting final video edits containing multiple mixed sources: guest Zoom audio, screen recording, background music, and sponsor shoutouts",
  "friction": "Different audio clips have wildly mismatched LUFS levels (-14 LUFS vs -24 LUFS). When uploaded to YouTube and Spotify, algorithms either penalize audio clarity or blast viewer ears during sponsor transitions. Viewers complain in comments about volume jumps.",
  "current_workaround": {
    "method": "Opening Audacity or Premiere Essential Sound, manually keyframing volume sliders on 30 separate audio clips, and re-exporting 3 times.",
    "tools_used": [
      "Adobe Premiere Pro",
      "Audacity",
      "Youlean Loudness Meter",
      "Manual playback"
    ],
    "drawbacks": "Adds 2.5 hours of boring, non-creative manual tweaking to every video export; still occasionally gets flagged with YouTube volume reduction warnings."
  },
  "cost_or_loss": {
    "summary": "10 to 12 hours wasted per month in manual waveform leveling, plus viewer retention drop-off on uneven audio transitions.",
    "time_lost_hours_per_month": 11.0,
    "financial_loss_usd_per_month": null,
    "emotional_toll": "regular_frustration"
  },
  "sentiment_intensity": "moderate",
  "paying_intent_clues": {
    "has_explicit_buying_statement": true,
    "existing_spend_on_workaround": false,
    "stated_budget_range": "$12-$20/month or $49 one-time plugin",
    "evidence_snippets": [
      "Auphonic is too clunky and upload-heavy for quick YouTube shorts. If there was a lightweight desktop drag-and-drop tool that normalized my audio stems to YouTube -14 LUFS in 5 seconds, I'd buy it on Gumroad in a heartbeat."
    ]
  },
  "source_url": "https://x.com/creator_jack_builds/status/1832000000000000000",
  "channel": "x_twitter",
  "channel_metadata": {
    "author": "@creator_jack_builds",
    "upvotes_or_likes": 67,
    "comment_count": 23,
    "post_date": "2026-09-07"
  },
  "raw_quote": "I spend more time fixing loudness spikes between my voice and sponsor reads than actually editing my video. Auphonic takes forever to upload 4GB files. Why is there no dead-simple local Mac app where I just drag an MP4 or WAV and it locks everything to -14 LUFS with zero compression artifacts? I would buy that Gumroad link immediately.",
  "confidence": 0.94,
  "tags": [
    "creators",
    "youtube",
    "podcasting",
    "audio-normalization",
    "lufs",
    "desktop-app"
  ],
  "cluster_id": "cluster-2026-creator-audio-normalization"
}
